{
  "schema_version": "0.1",
  "figure_type": "plot",
  "title": "Generated Plot",
  "layout": {
    "direction": "left-to-right",
    "spacing": 24
  },
  "nodes": [],
  "edges": [],
  "groups": [],
  "data": {
    "kind": "bar",
    "x": [
      "P30",
      "P27",
      "P413",
      "P1412",
      "P103",
      "P176",
      "P495",
      "P37",
      "P17",
      "P136",
      "P937",
      "P106",
      "P20",
      "P449",
      "P19",
      "P740",
      "P159",
      "P364",
      "P131",
      "P190",
      "P276",
      "P178",
      "P101",
      "P1303",
      "P39",
      "P127",
      "P140",
      "P108",
      "P641",
      "P138",
      "P407",
      "P463",
      "P36",
      "P264"
    ],
    "y": [
      959.0,
      958.0,
      952.0,
      924.0,
      919.0,
      911.0,
      904.0,
      891.0,
      875.0,
      847.0,
      846.0,
      821.0,
      816.0,
      794.0,
      779.0,
      774.0,
      756.0,
      751.0,
      714.0,
      621.0,
      613.0,
      579.0,
      545.0,
      513.0,
      476.0,
      433.0,
      430.0,
      350.0,
      318.0,
      279.0,
      216.0,
      163.0,
      139.0,
      53.0
    ],
    "source_columns": [
      "relation_id",
      "relation_records"
    ]
  },
  "provenance": {
    "source": "research_data\\cases\\atoms_counterfact_summary.csv",
    "format": "csv"
  },
  "style": {
    "theme": "academic_clean",
    "colors": {
      "baseline": "#94A3B8",
      "ours": "#2563EB"
    }
  }
}